{"run":50,"metric":8.17,"metrics":{"memory_mb":190},"status":"discard","description":"Reject slower index path #50","timestamp":1776705000000,"segment":0,"confidence":3.55,"asi":{"hypothesis":"try an alternate batching or cache strategy for the indexing pipeline","evidence":"seconds=8.17; memory_mb=190; best=7.88","next_action_hint":"Return to the best kept lane and try a smaller indexing change","rollback_reason":"slower than the best kept indexing path"}}
{"run":51,"metric":8.26,"metrics":{"memory_mb":190},"status":"discard","description":"Reject slower index path #51","timestamp":1776705300000,"segment":0,"confidence":3.5,"asi":{"hypothesis":"try an alternate batching or cache strategy for the indexing pipeline","evidence":"seconds=8.26; memory_mb=190; best=7.88","next_action_hint":"Return to the best kept lane and try a smaller indexing change","rollback_reason":"slower than the best kept indexing path"}}
{"run":52,"metric":8.33,"metrics":{"memory_mb":189},"status":"discard","description":"Reject slower index path #52","timestamp":1776705600000,"segment":0,"confidence":3.46,"asi":{"hypothesis":"try an alternate batching or cache strategy for the indexing pipeline","evidence":"seconds=8.33; memory_mb=189; best=7.88","next_action_hint":"Return to the best kept lane and try a smaller indexing change","rollback_reason":"slower than the best kept indexing path"}}
{"run":53,"metric":8.36,"metrics":{"memory_mb":189},"status":"discard","description":"Reject slower index path #53","timestamp":1776705900000,"segment":0,"confidence":3.41,"asi":{"hypothesis":"try an alternate batching or cache strategy for the indexing pipeline","evidence":"seconds=8.36; memory_mb=189; best=7.88","next_action_hint":"Return to the best kept lane and try a smaller indexing change","rollback_reason":"slower than the best kept indexing path"}}
{"run":54,"metric":8.33,"metrics":{"memory_mb":189},"status":"discard","description":"Reject slower index path #54","timestamp":1776706200000,"segment":0,"confidence":3.37,"asi":{"hypothesis":"try an alternate batching or cache strategy for the indexing pipeline","evidence":"seconds=8.33; memory_mb=189; best=7.88","next_action_hint":"Return to the best kept lane and try a smaller indexing change","rollback_reason":"slower than the best kept indexing path"}}
{"run":55,"metric":8.26,"metrics":{"memory_mb":189},"status":"discard","description":"Reject slower index path #55","timestamp":1776706500000,"segment":0,"confidence":3.32,"asi":{"hypothesis":"try an alternate batching or cache strategy for the indexing pipeline","evidence":"seconds=8.26; memory_mb=189; best=7.88","next_action_hint":"Return to the best kept lane and try a smaller indexing change","rollback_reason":"slower than the best kept indexing path"}}
{"run":56,"metric":8.15,"metrics":{"memory_mb":190},"status":"discard","description":"Reject slower index path #56","timestamp":1776706800000,"segment":0,"confidence":3.28,"asi":{"hypothesis":"try an alternate batching or cache strategy for the indexing pipeline","evidence":"seconds=8.15; memory_mb=190; best=7.88","next_action_hint":"Return to the best kept lane and try a smaller indexing change","rollback_reason":"slower than the best kept indexing path"}}
{"run":57,"metric":8.84,"metrics":{"memory_mb":190},"status":"discard","description":"Reject slower index path #57","timestamp":1776707100000,"segment":0,"confidence":3.24,"asi":{"hypothesis":"try an alternate batching or cache strategy for the indexing pipeline","evidence":"seconds=8.84; memory_mb=190; best=7.88","next_action_hint":"Return to the best kept lane and try a smaller indexing change","rollback_reason":"slower than the best kept indexing path"}}
{"run":58,"metric":7.83,"metrics":{"memory_mb":191},"status":"discard","description":"Reject slower index path #58","timestamp":1776707400000,"segment":0,"confidence":3.2,"asi":{"hypothesis":"try an alternate batching or cache strategy for the indexing pipeline","evidence":"seconds=7.83; memory_mb=191; best=7.88","next_action_hint":"Return to the best kept lane and try a smaller indexing change","rollback_reason":"slower than the best kept indexing path"}}
{"run":59,"metric":7.66,"metrics":{"memory_mb":192},"status":"keep","description":"Keep faster index path #59","timestamp":1776707700000,"segment":0,"confidence":3.48,"asi":{"hypothesis":"reuse parsed document manifests and stream index batches","evidence":"seconds=7.66; memory_mb=192; best=7.66","next_action_hint":"Confirm the faster path against memory footprint and index correctness checks"}}
{"run":60,"metric":7.51,"metrics":{"memory_mb":194},"status":"keep","description":"Keep faster index path #60","timestamp":1776708000000,"segment":0,"confidence":3.66,"asi":{"hypothesis":"reuse parsed document manifests and stream index batches","evidence":"seconds=7.51; memory_mb=194; best=7.51","next_action_hint":"Confirm the faster path against memory footprint and index correctness checks"}}
{"run":61,"metric":7.39,"metrics":{"memory_mb":195},"status":"keep","description":"Keep faster index path #61","timestamp":1776708300000,"segment":0,"confidence":3.79,"asi":{"hypothesis":"reuse parsed document manifests and stream index batches","evidence":"seconds=7.39; memory_mb=195; best=7.39","next_action_hint":"Confirm the faster path against memory footprint and index correctness checks"}}
{"run":62,"metric":7.31,"metrics":{"memory_mb":197},"status":"checks_failed","description":"Checks caught unsafe index path #62","timestamp":1776708600000,"segment":0,"confidence":3.75,"asi":{"hypothesis":"try an aggressive indexing cache or batch strategy","evidence":"seconds=7.31; memory_mb=197; best=7.39","next_action_hint":"Return to the best kept lane and try a smaller indexing change","rollback_reason":"correctness or memory checks failed despite a measurable speedup"}}
{"run":63,"metric":7.29,"metrics":{"memory_mb":198},"status":"keep","description":"Keep faster index path #63","timestamp":1776708900000,"segment":0,"confidence":3.84,"asi":{"hypothesis":"reuse parsed document manifests and stream index batches","evidence":"seconds=7.29; memory_mb=198; best=7.29","next_action_hint":"Confirm the faster path against memory footprint and index correctness checks"}}
{"run":64,"metric":7.3,"metrics":{"memory_mb":200},"status":"discard","description":"Reject slower index path #64","timestamp":1776709200000,"segment":0,"confidence":3.8,"asi":{"hypothesis":"try an alternate batching or cache strategy for the indexing pipeline","evidence":"seconds=7.3; memory_mb=200; best=7.29","next_action_hint":"Return to the best kept lane and try a smaller indexing change","rollback_reason":"slower than the best kept indexing path"}}
{"run":65,"metric":7.35,"metrics":{"memory_mb":201},"status":"discard","description":"Reject slower index path #65","timestamp":1776709500000,"segment":0,"confidence":3.76,"asi":{"hypothesis":"try an alternate batching or cache strategy for the indexing pipeline","evidence":"seconds=7.35; memory_mb=201; best=7.29","next_action_hint":"Return to the best kept lane and try a smaller indexing change","rollback_reason":"slower than the best kept indexing path"}}
{"run":66,"metric":7.42,"metrics":{"memory_mb":203},"status":"discard","description":"Reject slower index path #66","timestamp":1776709800000,"segment":0,"confidence":3.71,"asi":{"hypothesis":"try an alternate batching or cache strategy for the indexing pipeline","evidence":"seconds=7.42; memory_mb=203; best=7.29","next_action_hint":"Return to the best kept lane and try a smaller indexing change","rollback_reason":"slower than the best kept indexing path"}}
{"run":67,"metric":7.49,"metrics":{"memory_mb":204},"status":"discard","description":"Reject slower index path #67","timestamp":1776710100000,"segment":0,"confidence":3.67,"asi":{"hypothesis":"try an alternate batching or cache strategy for the indexing pipeline","evidence":"seconds=7.49; memory_mb=204; best=7.29","next_action_hint":"Return to the best kept lane and try a smaller indexing change","rollback_reason":"slower than the best kept indexing path"}}
{"run":68,"metric":7.54,"metrics":{"memory_mb":205},"status":"discard","description":"Reject slower index path #68","timestamp":1776710400000,"segment":0,"confidence":3.63,"asi":{"hypothesis":"try an alternate batching or cache strategy for the indexing pipeline","evidence":"seconds=7.54; memory_mb=205; best=7.29","next_action_hint":"Return to the best kept lane and try a smaller indexing change","rollback_reason":"slower than the best kept indexing path"}}
{"run":69,"metric":7.56,"metrics":{"memory_mb":206},"status":"discard","description":"Reject slower index path #69","timestamp":1776710700000,"segment":0,"confidence":3.59,"asi":{"hypothesis":"try an alternate batching or cache strategy for the indexing pipeline","evidence":"seconds=7.56; memory_mb=206; best=7.29","next_action_hint":"Return to the best kept lane and try a smaller indexing change","rollback_reason":"slower than the best kept indexing path"}}
{"run":70,"metric":7.54,"metrics":{"memory_mb":206},"status":"discard","description":"Reject slower index path #70","timestamp":1776711000000,"segment":0,"confidence":3.55,"asi":{"hypothesis":"try an alternate batching or cache strategy for the indexing pipeline","evidence":"seconds=7.54; memory_mb=206; best=7.29","next_action_hint":"Return to the best kept lane and try a smaller indexing change","rollback_reason":"slower than the best kept indexing path"}}
{"run":71,"metric":7.47,"metrics":{"memory_mb":207},"status":"discard","description":"Reject slower index path #71","timestamp":1776711300000,"segment":0,"confidence":3.51,"asi":{"hypothesis":"try an alternate batching or cache strategy for the indexing pipeline","evidence":"seconds=7.47; memory_mb=207; best=7.29","next_action_hint":"Return to the best kept lane and try a smaller indexing change","rollback_reason":"slower than the best kept indexing path"}}
{"run":72,"metric":7.35,"metrics":{"memory_mb":207},"status":"discard","description":"Reject slower index path #72","timestamp":1776711600000,"segment":0,"confidence":3.47,"asi":{"hypothesis":"try an alternate batching or cache strategy for the indexing pipeline","evidence":"seconds=7.35; memory_mb=207; best=7.29","next_action_hint":"Return to the best kept lane and try a smaller indexing change","rollback_reason":"slower than the best kept indexing path"}}
{"run":73,"metric":7.19,"metrics":{"memory_mb":207},"status":"keep","description":"Keep faster index path #73","timestamp":1776711900000,"segment":0,"confidence":3.56,"asi":{"hypothesis":"reuse parsed document manifests and stream index batches","evidence":"seconds=7.19; memory_mb=207; best=7.19","next_action_hint":"Confirm the faster path against memory footprint and index correctness checks"}}
{"run":74,"metric":8.11,"metrics":{"memory_mb":207},"status":"discard","description":"Reject slower index path #74","timestamp":1776712200000,"segment":0,"confidence":3.53,"asi":{"hypothesis":"try an alternate batching or cache strategy for the indexing pipeline","evidence":"seconds=8.11; memory_mb=207; best=7.19","next_action_hint":"Return to the best kept lane and try a smaller indexing change","rollback_reason":"slower than the best kept indexing path"}}
{"run":75,"metric":6.82,"metrics":{"memory_mb":206},"status":"keep","description":"Keep faster index path #75","timestamp":1776712500000,"segment":0,"confidence":3.95,"asi":{"hypothesis":"reuse parsed document manifests and stream index batches","evidence":"seconds=6.82; memory_mb=206; best=6.82","next_action_hint":"Confirm the faster path against memory footprint and index correctness checks"}}
{"run":76,"metric":7.49,"metrics":{"memory_mb":206},"status":"discard","description":"Reject slower index path #76","timestamp":1776712800000,"segment":0,"confidence":3.91,"asi":{"hypothesis":"try an alternate batching or cache strategy for the indexing pipeline","evidence":"seconds=7.49; memory_mb=206; best=6.82","next_action_hint":"Return to the best kept lane and try a smaller indexing change","rollback_reason":"slower than the best kept indexing path"}}
{"run":77,"metric":6.5,"metrics":{"memory_mb":205},"status":"keep","description":"Keep faster index path #77","timestamp":1776713100000,"segment":0,"confidence":4.26,"asi":{"hypothesis":"reuse parsed document manifests and stream index batches","evidence":"seconds=6.5; memory_mb=205; best=6.5","next_action_hint":"Confirm the faster path against memory footprint and index correctness checks"}}
{"run":78,"metric":6.39,"metrics":{"memory_mb":204},"status":"keep","description":"Keep faster index path #78","timestamp":1776713400000,"segment":0,"confidence":4.35,"asi":{"hypothesis":"reuse parsed document manifests and stream index batches","evidence":"seconds=6.39; memory_mb=204; best=6.39","next_action_hint":"Confirm the faster path against memory footprint and index correctness checks"}}
{"run":79,"metric":6.33,"metrics":{"memory_mb":203},"status":"discard","description":"Reject slower index path #79","timestamp":1776713700000,"segment":0,"confidence":4.31,"asi":{"hypothesis":"try an alternate batching or cache strategy for the indexing pipeline","evidence":"seconds=6.33; memory_mb=203; best=6.39","next_action_hint":"Return to the best kept lane and try a smaller indexing change","rollback_reason":"slower than the best kept indexing path"}}
{"run":80,"metric":6.33,"metrics":{"memory_mb":202},"status":"discard","description":"Reject slower index path #80","timestamp":1776714000000,"segment":0,"confidence":4.26,"asi":{"hypothesis":"try an alternate batching or cache strategy for the indexing pipeline","evidence":"seconds=6.33; memory_mb=202; best=6.39","next_action_hint":"Return to the best kept lane and try a smaller indexing change","rollback_reason":"slower than the best kept indexing path"}}
{"run":81,"metric":6.36,"metrics":{"memory_mb":202},"status":"discard","description":"Reject slower index path #81","timestamp":1776714300000,"segment":0,"confidence":4.22,"asi":{"hypothesis":"try an alternate batching or cache strategy for the indexing pipeline","evidence":"seconds=6.36; memory_mb=202; best=6.39","next_action_hint":"Return to the best kept lane and try a smaller indexing change","rollback_reason":"slower than the best kept indexing path"}}
{"run":82,"metric":6.43,"metrics":{"memory_mb":201},"status":"discard","description":"Reject slower index path #82","timestamp":1776714600000,"segment":0,"confidence":4.18,"asi":{"hypothesis":"try an alternate batching or cache strategy for the indexing pipeline","evidence":"seconds=6.43; memory_mb=201; best=6.39","next_action_hint":"Return to the best kept lane and try a smaller indexing change","rollback_reason":"slower than the best kept indexing path"}}
{"run":83,"metric":6.51,"metrics":{"memory_mb":200},"status":"discard","description":"Reject slower index path #83","timestamp":1776714900000,"segment":0,"confidence":4.14,"asi":{"hypothesis":"try an alternate batching or cache strategy for the indexing pipeline","evidence":"seconds=6.51; memory_mb=200; best=6.39","next_action_hint":"Return to the best kept lane and try a smaller indexing change","rollback_reason":"slower than the best kept indexing path"}}
{"run":84,"metric":6.58,"metrics":{"memory_mb":200},"status":"discard","description":"Reject slower index path #84","timestamp":1776715200000,"segment":0,"confidence":4.1,"asi":{"hypothesis":"try an alternate batching or cache strategy for the indexing pipeline","evidence":"seconds=6.58; memory_mb=200; best=6.39","next_action_hint":"Return to the best kept lane and try a smaller indexing change","rollback_reason":"slower than the best kept indexing path"}}
{"run":85,"metric":6.64,"metrics":{"memory_mb":200},"status":"discard","description":"Reject slower index path #85","timestamp":1776715500000,"segment":0,"confidence":4.06,"asi":{"hypothesis":"try an alternate batching or cache strategy for the indexing pipeline","evidence":"seconds=6.64; memory_mb=200; best=6.39","next_action_hint":"Return to the best kept lane and try a smaller indexing change","rollback_reason":"slower than the best kept indexing path"}}
{"run":86,"metric":6.66,"metrics":{"memory_mb":200},"status":"discard","description":"Reject slower index path #86","timestamp":1776715800000,"segment":0,"confidence":4.03,"asi":{"hypothesis":"try an alternate batching or cache strategy for the indexing pipeline","evidence":"seconds=6.66; memory_mb=200; best=6.39","next_action_hint":"Return to the best kept lane and try a smaller indexing change","rollback_reason":"slower than the best kept indexing path"}}
{"run":87,"metric":6.63,"metrics":{"memory_mb":200},"status":"discard","description":"Reject slower index path #87","timestamp":1776716100000,"segment":0,"confidence":3.99,"asi":{"hypothesis":"try an alternate batching or cache strategy for the indexing pipeline","evidence":"seconds=6.63; memory_mb=200; best=6.39","next_action_hint":"Return to the best kept lane and try a smaller indexing change","rollback_reason":"slower than the best kept indexing path"}}
{"run":88,"metric":6.56,"metrics":{"memory_mb":201},"status":"discard","description":"Reject slower index path #88","timestamp":1776716400000,"segment":0,"confidence":3.95,"asi":{"hypothesis":"try an alternate batching or cache strategy for the indexing pipeline","evidence":"seconds=6.56; memory_mb=201; best=6.39","next_action_hint":"Return to the best kept lane and try a smaller indexing change","rollback_reason":"slower than the best kept indexing path"}}
{"run":89,"metric":6.45,"metrics":{"memory_mb":202},"status":"discard","description":"Reject slower index path #89","timestamp":1776716700000,"segment":0,"confidence":3.92,"asi":{"hypothesis":"try an alternate batching or cache strategy for the indexing pipeline","evidence":"seconds=6.45; memory_mb=202; best=6.39","next_action_hint":"Return to the best kept lane and try a smaller indexing change","rollback_reason":"slower than the best kept indexing path"}}
{"run":90,"metric":6.31,"metrics":{"memory_mb":203},"status":"discard","description":"Reject slower index path #90","timestamp":1776717000000,"segment":0,"confidence":3.88,"asi":{"hypothesis":"try an alternate batching or cache strategy for the indexing pipeline","evidence":"seconds=6.31; memory_mb=203; best=6.39","next_action_hint":"Return to the best kept lane and try a smaller indexing change","rollback_reason":"slower than the best kept indexing path"}}
{"run":91,"metric":6.15,"metrics":{"memory_mb":204},"status":"keep","description":"Keep faster index path #91","timestamp":1776717300000,"segment":0,"confidence":4.1,"asi":{"hypothesis":"reuse parsed document manifests and stream index batches","evidence":"seconds=6.15; memory_mb=204; best=6.15","next_action_hint":"Confirm the faster path against memory footprint and index correctness checks"}}
{"run":92,"metric":6,"metrics":{"memory_mb":206},"status":"keep","description":"Keep faster index path #92","timestamp":1776717600000,"segment":0,"confidence":4.23,"asi":{"hypothesis":"reuse parsed document manifests and stream index batches","evidence":"seconds=6; memory_mb=206; best=6","next_action_hint":"Confirm the faster path against memory footprint and index correctness checks"}}
{"run":93,"metric":5.86,"metrics":{"memory_mb":207},"status":"keep","description":"Keep faster index path #93","timestamp":1776717900000,"segment":0,"confidence":4.34,"asi":{"hypothesis":"reuse parsed document manifests and stream index batches","evidence":"seconds=5.86; memory_mb=207; best=5.86","next_action_hint":"Confirm the faster path against memory footprint and index correctness checks"}}
{"run":94,"metric":5.77,"metrics":{"memory_mb":209},"status":"keep","description":"Keep faster index path #94","timestamp":1776718200000,"segment":0,"confidence":4.39,"asi":{"hypothesis":"reuse parsed document manifests and stream index batches","evidence":"seconds=5.77; memory_mb=209; best=5.77","next_action_hint":"Confirm the faster path against memory footprint and index correctness checks"}}
{"run":95,"metric":6.56,"metrics":{"memory_mb":210},"status":"discard","description":"Reject slower index path #95","timestamp":1776718500000,"segment":0,"confidence":4.35,"asi":{"hypothesis":"try an alternate batching or cache strategy for the indexing pipeline","evidence":"seconds=6.56; memory_mb=210; best=5.77","next_action_hint":"Return to the best kept lane and try a smaller indexing change","rollback_reason":"slower than the best kept indexing path"}}
{"run":96,"metric":5.71,"metrics":{"memory_mb":212},"status":"discard","description":"Reject slower index path #96","timestamp":1776718800000,"segment":0,"confidence":4.32,"asi":{"hypothesis":"try an alternate batching or cache strategy for the indexing pipeline","evidence":"seconds=5.71; memory_mb=212; best=5.77","next_action_hint":"Return to the best kept lane and try a smaller indexing change","rollback_reason":"slower than the best kept indexing path"}}
{"run":97,"metric":5.75,"metrics":{"memory_mb":213},"status":"discard","description":"Reject slower index path #97","timestamp":1776719100000,"segment":0,"confidence":4.28,"asi":{"hypothesis":"try an alternate batching or cache strategy for the indexing pipeline","evidence":"seconds=5.75; memory_mb=213; best=5.77","next_action_hint":"Return to the best kept lane and try a smaller indexing change","rollback_reason":"slower than the best kept indexing path"}}
{"run":98,"metric":5.83,"metrics":{"memory_mb":214},"status":"discard","description":"Reject slower index path #98","timestamp":1776719400000,"segment":0,"confidence":4.24,"asi":{"hypothesis":"try an alternate batching or cache strategy for the indexing pipeline","evidence":"seconds=5.83; memory_mb=214; best=5.77","next_action_hint":"Return to the best kept lane and try a smaller indexing change","rollback_reason":"slower than the best kept indexing path"}}
