{"run":99,"metric":5.94,"metrics":{"memory_mb":216},"status":"discard","description":"Reject slower index path #99","timestamp":1776719700000,"segment":0,"confidence":4.21,"asi":{"hypothesis":"try an alternate batching or cache strategy for the indexing pipeline","evidence":"seconds=5.94; memory_mb=216; best=5.77","next_action_hint":"Return to the best kept lane and try a smaller indexing change","rollback_reason":"slower than the best kept indexing path"}}
{"run":100,"metric":5.62,"metrics":{"memory_mb":216},"status":"keep","description":"Keep faster index path #100","timestamp":1776720000000,"segment":0,"confidence":4.32,"asi":{"hypothesis":"reuse parsed document manifests and stream index batches","evidence":"seconds=5.62; memory_mb=216; best=5.62","next_action_hint":"Confirm the faster path against memory footprint and index correctness checks"}}
