{"type":"config","name":"Indexing Pipeline Speed and Memory Footprint Optimization","metricName":"seconds","metricUnit":"s","bestDirection":"lower","metricFormula":"seconds = wall-clock time to rebuild the indexing corpus; memory_mb tracks peak memory separately; lower seconds is better."}
{"run":1,"metric":10,"metrics":{"memory_mb":178},"status":"measure","description":"Baseline indexing pipeline","timestamp":1776690300000,"segment":0,"confidence":null,"asi":{"hypothesis":"measure the current document indexing path before changing cache and batch behavior","evidence":"seconds=10; memory_mb=178; baseline=10","next_action_hint":"Try incremental manifest reuse while watching memory footprint and correctness checks"}}
{"run":2,"metric":10.37,"metrics":{"memory_mb":179},"status":"discard","description":"Reject slower index path #2","timestamp":1776690600000,"segment":0,"confidence":null,"asi":{"hypothesis":"try an alternate batching or cache strategy for the indexing pipeline","evidence":"seconds=10.37; memory_mb=179; best=10","next_action_hint":"Return to the best kept lane and try a smaller indexing change","rollback_reason":"slower than the best kept indexing path"}}
{"run":3,"metric":10.4,"metrics":{"memory_mb":180},"status":"discard","description":"Reject slower index path #3","timestamp":1776690900000,"segment":0,"confidence":null,"asi":{"hypothesis":"try an alternate batching or cache strategy for the indexing pipeline","evidence":"seconds=10.4; memory_mb=180; best=10","next_action_hint":"Return to the best kept lane and try a smaller indexing change","rollback_reason":"slower than the best kept indexing path"}}
{"run":4,"metric":10.38,"metrics":{"memory_mb":182},"status":"discard","description":"Reject slower index path #4","timestamp":1776691200000,"segment":0,"confidence":1,"asi":{"hypothesis":"try an alternate batching or cache strategy for the indexing pipeline","evidence":"seconds=10.38; memory_mb=182; best=10","next_action_hint":"Return to the best kept lane and try a smaller indexing change","rollback_reason":"slower than the best kept indexing path"}}
{"run":5,"metric":10.31,"metrics":{"memory_mb":183},"status":"discard","description":"Reject slower index path #5","timestamp":1776691500000,"segment":0,"confidence":1,"asi":{"hypothesis":"try an alternate batching or cache strategy for the indexing pipeline","evidence":"seconds=10.31; memory_mb=183; best=10","next_action_hint":"Return to the best kept lane and try a smaller indexing change","rollback_reason":"slower than the best kept indexing path"}}
{"run":6,"metric":10.2,"metrics":{"memory_mb":184},"status":"discard","description":"Reject slower index path #6","timestamp":1776691800000,"segment":0,"confidence":1,"asi":{"hypothesis":"try an alternate batching or cache strategy for the indexing pipeline","evidence":"seconds=10.2; memory_mb=184; best=10","next_action_hint":"Return to the best kept lane and try a smaller indexing change","rollback_reason":"slower than the best kept indexing path"}}
{"run":7,"metric":10.04,"metrics":{"memory_mb":184},"status":"discard","description":"Reject slower index path #7","timestamp":1776692100000,"segment":0,"confidence":1,"asi":{"hypothesis":"try an alternate batching or cache strategy for the indexing pipeline","evidence":"seconds=10.04; memory_mb=184; best=10","next_action_hint":"Return to the best kept lane and try a smaller indexing change","rollback_reason":"slower than the best kept indexing path"}}
{"run":8,"metric":9.86,"metrics":{"memory_mb":185},"status":"keep","description":"Keep faster index path #8","timestamp":1776692400000,"segment":0,"confidence":1,"asi":{"hypothesis":"reuse parsed document manifests and stream index batches","evidence":"seconds=9.86; memory_mb=185; best=9.86","next_action_hint":"Confirm the faster path against memory footprint and index correctness checks"}}
{"run":9,"metric":9.68,"metrics":{"memory_mb":185},"status":"keep","description":"Keep faster index path #9","timestamp":1776692700000,"segment":0,"confidence":1.25,"asi":{"hypothesis":"reuse parsed document manifests and stream index batches","evidence":"seconds=9.68; memory_mb=185; best=9.68","next_action_hint":"Confirm the faster path against memory footprint and index correctness checks"}}
{"run":10,"metric":9.5,"metrics":{"memory_mb":185},"status":"keep","description":"Keep faster index path #10","timestamp":1776693000000,"segment":0,"confidence":1.9,"asi":{"hypothesis":"reuse parsed document manifests and stream index batches","evidence":"seconds=9.5; memory_mb=185; best=9.5","next_action_hint":"Confirm the faster path against memory footprint and index correctness checks"}}
{"run":11,"metric":9.36,"metrics":{"memory_mb":185},"status":"keep","description":"Keep faster index path #11","timestamp":1776693300000,"segment":0,"confidence":2.36,"asi":{"hypothesis":"reuse parsed document manifests and stream index batches","evidence":"seconds=9.36; memory_mb=185; best=9.36","next_action_hint":"Confirm the faster path against memory footprint and index correctness checks"}}
{"run":12,"metric":9.26,"metrics":{"memory_mb":184},"status":"keep","description":"Keep faster index path #12","timestamp":1776693600000,"segment":0,"confidence":2.64,"asi":{"hypothesis":"reuse parsed document manifests and stream index batches","evidence":"seconds=9.26; memory_mb=184; best=9.26","next_action_hint":"Confirm the faster path against memory footprint and index correctness checks"}}
{"run":13,"metric":9.2,"metrics":{"memory_mb":184},"status":"discard","description":"Reject slower index path #13","timestamp":1776693900000,"segment":0,"confidence":2.57,"asi":{"hypothesis":"try an alternate batching or cache strategy for the indexing pipeline","evidence":"seconds=9.2; memory_mb=184; best=9.26","next_action_hint":"Return to the best kept lane and try a smaller indexing change","rollback_reason":"slower than the best kept indexing path"}}
{"run":14,"metric":9.19,"metrics":{"memory_mb":183},"status":"discard","description":"Reject slower index path #14","timestamp":1776694200000,"segment":0,"confidence":2.49,"asi":{"hypothesis":"try an alternate batching or cache strategy for the indexing pipeline","evidence":"seconds=9.19; memory_mb=183; best=9.26","next_action_hint":"Return to the best kept lane and try a smaller indexing change","rollback_reason":"slower than the best kept indexing path"}}
{"run":15,"metric":9.22,"metrics":{"memory_mb":182},"status":"discard","description":"Reject slower index path #15","timestamp":1776694500000,"segment":0,"confidence":2.43,"asi":{"hypothesis":"try an alternate batching or cache strategy for the indexing pipeline","evidence":"seconds=9.22; memory_mb=182; best=9.26","next_action_hint":"Return to the best kept lane and try a smaller indexing change","rollback_reason":"slower than the best kept indexing path"}}
{"run":16,"metric":9.28,"metrics":{"memory_mb":181},"status":"discard","description":"Reject slower index path #16","timestamp":1776694800000,"segment":0,"confidence":2.36,"asi":{"hypothesis":"try an alternate batching or cache strategy for the indexing pipeline","evidence":"seconds=9.28; memory_mb=181; best=9.26","next_action_hint":"Return to the best kept lane and try a smaller indexing change","rollback_reason":"slower than the best kept indexing path"}}
{"run":17,"metric":9.35,"metrics":{"memory_mb":180},"status":"discard","description":"Reject slower index path #17","timestamp":1776695100000,"segment":0,"confidence":2.3,"asi":{"hypothesis":"try an alternate batching or cache strategy for the indexing pipeline","evidence":"seconds=9.35; memory_mb=180; best=9.26","next_action_hint":"Return to the best kept lane and try a smaller indexing change","rollback_reason":"slower than the best kept indexing path"}}
{"run":18,"metric":9.41,"metrics":{"memory_mb":180},"status":"discard","description":"Reject slower index path #18","timestamp":1776695400000,"segment":0,"confidence":2.24,"asi":{"hypothesis":"try an alternate batching or cache strategy for the indexing pipeline","evidence":"seconds=9.41; memory_mb=180; best=9.26","next_action_hint":"Return to the best kept lane and try a smaller indexing change","rollback_reason":"slower than the best kept indexing path"}}
{"run":19,"metric":10.3,"metrics":{"memory_mb":179},"status":"discard","description":"Reject slower index path #19","timestamp":1776695700000,"segment":0,"confidence":2.19,"asi":{"hypothesis":"try an alternate batching or cache strategy for the indexing pipeline","evidence":"seconds=10.3; memory_mb=179; best=9.26","next_action_hint":"Return to the best kept lane and try a smaller indexing change","rollback_reason":"slower than the best kept indexing path"}}
{"run":20,"metric":9.44,"metrics":{"memory_mb":178},"status":"discard","description":"Reject slower index path #20","timestamp":1776696000000,"segment":0,"confidence":2.13,"asi":{"hypothesis":"try an alternate batching or cache strategy for the indexing pipeline","evidence":"seconds=9.44; memory_mb=178; best=9.26","next_action_hint":"Return to the best kept lane and try a smaller indexing change","rollback_reason":"slower than the best kept indexing path"}}
{"run":21,"metric":9.4,"metrics":{"memory_mb":178},"status":"discard","description":"Reject slower index path #21","timestamp":1776696300000,"segment":0,"confidence":2.08,"asi":{"hypothesis":"try an alternate batching or cache strategy for the indexing pipeline","evidence":"seconds=9.4; memory_mb=178; best=9.26","next_action_hint":"Return to the best kept lane and try a smaller indexing change","rollback_reason":"slower than the best kept indexing path"}}
{"run":22,"metric":9.3,"metrics":{"memory_mb":178},"status":"discard","description":"Reject slower index path #22","timestamp":1776696600000,"segment":0,"confidence":2.04,"asi":{"hypothesis":"try an alternate batching or cache strategy for the indexing pipeline","evidence":"seconds=9.3; memory_mb=178; best=9.26","next_action_hint":"Return to the best kept lane and try a smaller indexing change","rollback_reason":"slower than the best kept indexing path"}}
{"run":23,"metric":9.17,"metrics":{"memory_mb":178},"status":"keep","description":"Keep faster index path #23","timestamp":1776696900000,"segment":0,"confidence":2.23,"asi":{"hypothesis":"reuse parsed document manifests and stream index batches","evidence":"seconds=9.17; memory_mb=178; best=9.17","next_action_hint":"Confirm the faster path against memory footprint and index correctness checks"}}
{"run":24,"metric":9,"metrics":{"memory_mb":178},"status":"keep","description":"Keep faster index path #24","timestamp":1776697200000,"segment":0,"confidence":2.63,"asi":{"hypothesis":"reuse parsed document manifests and stream index batches","evidence":"seconds=9; memory_mb=178; best=9","next_action_hint":"Confirm the faster path against memory footprint and index correctness checks"}}
{"run":25,"metric":8.82,"metrics":{"memory_mb":179},"status":"keep","description":"Keep faster index path #25","timestamp":1776697500000,"segment":0,"confidence":3.04,"asi":{"hypothesis":"reuse parsed document manifests and stream index batches","evidence":"seconds=8.82; memory_mb=179; best=8.82","next_action_hint":"Confirm the faster path against memory footprint and index correctness checks"}}
{"run":26,"metric":8.65,"metrics":{"memory_mb":180},"status":"keep","description":"Keep faster index path #26","timestamp":1776697800000,"segment":0,"confidence":3.4,"asi":{"hypothesis":"reuse parsed document manifests and stream index batches","evidence":"seconds=8.65; memory_mb=180; best=8.65","next_action_hint":"Confirm the faster path against memory footprint and index correctness checks"}}
{"run":27,"metric":8.5,"metrics":{"memory_mb":181},"status":"keep","description":"Keep faster index path #27","timestamp":1776698100000,"segment":0,"confidence":3.7,"asi":{"hypothesis":"reuse parsed document manifests and stream index batches","evidence":"seconds=8.5; memory_mb=181; best=8.5","next_action_hint":"Confirm the faster path against memory footprint and index correctness checks"}}
{"run":28,"metric":8.39,"metrics":{"memory_mb":182},"status":"keep","description":"Keep faster index path #28","timestamp":1776698400000,"segment":0,"confidence":3.9,"asi":{"hypothesis":"reuse parsed document manifests and stream index batches","evidence":"seconds=8.39; memory_mb=182; best=8.39","next_action_hint":"Confirm the faster path against memory footprint and index correctness checks"}}
{"run":29,"metric":8.33,"metrics":{"memory_mb":183},"status":"discard","description":"Reject slower index path #29","timestamp":1776698700000,"segment":0,"confidence":3.82,"asi":{"hypothesis":"try an alternate batching or cache strategy for the indexing pipeline","evidence":"seconds=8.33; memory_mb=183; best=8.39","next_action_hint":"Return to the best kept lane and try a smaller indexing change","rollback_reason":"slower than the best kept indexing path"}}
{"run":30,"metric":8.32,"metrics":{"memory_mb":185},"status":"discard","description":"Reject slower index path #30","timestamp":1776699000000,"segment":0,"confidence":3.74,"asi":{"hypothesis":"try an alternate batching or cache strategy for the indexing pipeline","evidence":"seconds=8.32; memory_mb=185; best=8.39","next_action_hint":"Return to the best kept lane and try a smaller indexing change","rollback_reason":"slower than the best kept indexing path"}}
{"run":31,"metric":8.36,"metrics":{"memory_mb":186},"status":"checks_failed","description":"Checks caught unsafe index path #31","timestamp":1776699300000,"segment":0,"confidence":3.67,"asi":{"hypothesis":"try an aggressive indexing cache or batch strategy","evidence":"seconds=8.36; memory_mb=186; best=8.39","next_action_hint":"Return to the best kept lane and try a smaller indexing change","rollback_reason":"correctness or memory checks failed despite a measurable speedup"}}
{"run":32,"metric":8.43,"metrics":{"memory_mb":188},"status":"discard","description":"Reject slower index path #32","timestamp":1776699600000,"segment":0,"confidence":3.6,"asi":{"hypothesis":"try an alternate batching or cache strategy for the indexing pipeline","evidence":"seconds=8.43; memory_mb=188; best=8.39","next_action_hint":"Return to the best kept lane and try a smaller indexing change","rollback_reason":"slower than the best kept indexing path"}}
{"run":33,"metric":8.52,"metrics":{"memory_mb":189},"status":"discard","description":"Reject slower index path #33","timestamp":1776699900000,"segment":0,"confidence":3.54,"asi":{"hypothesis":"try an alternate batching or cache strategy for the indexing pipeline","evidence":"seconds=8.52; memory_mb=189; best=8.39","next_action_hint":"Return to the best kept lane and try a smaller indexing change","rollback_reason":"slower than the best kept indexing path"}}
{"run":34,"metric":8.62,"metrics":{"memory_mb":191},"status":"discard","description":"Reject slower index path #34","timestamp":1776700200000,"segment":0,"confidence":3.47,"asi":{"hypothesis":"try an alternate batching or cache strategy for the indexing pipeline","evidence":"seconds=8.62; memory_mb=191; best=8.39","next_action_hint":"Return to the best kept lane and try a smaller indexing change","rollback_reason":"slower than the best kept indexing path"}}
{"run":35,"metric":8.7,"metrics":{"memory_mb":192},"status":"discard","description":"Reject slower index path #35","timestamp":1776700500000,"segment":0,"confidence":3.41,"asi":{"hypothesis":"try an alternate batching or cache strategy for the indexing pipeline","evidence":"seconds=8.7; memory_mb=192; best=8.39","next_action_hint":"Return to the best kept lane and try a smaller indexing change","rollback_reason":"slower than the best kept indexing path"}}
{"run":36,"metric":8.75,"metrics":{"memory_mb":193},"status":"discard","description":"Reject slower index path #36","timestamp":1776700800000,"segment":0,"confidence":3.35,"asi":{"hypothesis":"try an alternate batching or cache strategy for the indexing pipeline","evidence":"seconds=8.75; memory_mb=193; best=8.39","next_action_hint":"Return to the best kept lane and try a smaller indexing change","rollback_reason":"slower than the best kept indexing path"}}
{"run":37,"metric":9.86,"metrics":{"memory_mb":194},"status":"discard","description":"Reject slower index path #37","timestamp":1776701100000,"segment":0,"confidence":3.3,"asi":{"hypothesis":"try an alternate batching or cache strategy for the indexing pipeline","evidence":"seconds=9.86; memory_mb=194; best=8.39","next_action_hint":"Return to the best kept lane and try a smaller indexing change","rollback_reason":"slower than the best kept indexing path"}}
{"run":38,"metric":9.57,"metrics":{"memory_mb":195},"status":"discard","description":"Reject slower index path #38","timestamp":1776701400000,"segment":0,"confidence":3.24,"asi":{"hypothesis":"try an alternate batching or cache strategy for the indexing pipeline","evidence":"seconds=9.57; memory_mb=195; best=8.39","next_action_hint":"Return to the best kept lane and try a smaller indexing change","rollback_reason":"slower than the best kept indexing path"}}
{"run":39,"metric":8.63,"metrics":{"memory_mb":196},"status":"discard","description":"Reject slower index path #39","timestamp":1776701700000,"segment":0,"confidence":3.19,"asi":{"hypothesis":"try an alternate batching or cache strategy for the indexing pipeline","evidence":"seconds=8.63; memory_mb=196; best=8.39","next_action_hint":"Return to the best kept lane and try a smaller indexing change","rollback_reason":"slower than the best kept indexing path"}}
{"run":40,"metric":8.51,"metrics":{"memory_mb":196},"status":"discard","description":"Reject slower index path #40","timestamp":1776702000000,"segment":0,"confidence":3.14,"asi":{"hypothesis":"try an alternate batching or cache strategy for the indexing pipeline","evidence":"seconds=8.51; memory_mb=196; best=8.39","next_action_hint":"Return to the best kept lane and try a smaller indexing change","rollback_reason":"slower than the best kept indexing path"}}
{"run":41,"metric":8.37,"metrics":{"memory_mb":196},"status":"discard","description":"Reject slower index path #41","timestamp":1776702300000,"segment":0,"confidence":3.09,"asi":{"hypothesis":"try an alternate batching or cache strategy for the indexing pipeline","evidence":"seconds=8.37; memory_mb=196; best=8.39","next_action_hint":"Return to the best kept lane and try a smaller indexing change","rollback_reason":"slower than the best kept indexing path"}}
{"run":42,"metric":8.22,"metrics":{"memory_mb":196},"status":"keep","description":"Keep faster index path #42","timestamp":1776702600000,"segment":0,"confidence":3.36,"asi":{"hypothesis":"reuse parsed document manifests and stream index batches","evidence":"seconds=8.22; memory_mb=196; best=8.22","next_action_hint":"Confirm the faster path against memory footprint and index correctness checks"}}
{"run":43,"metric":8.08,"metrics":{"memory_mb":195},"status":"keep","description":"Keep faster index path #43","timestamp":1776702900000,"segment":0,"confidence":3.57,"asi":{"hypothesis":"reuse parsed document manifests and stream index batches","evidence":"seconds=8.08; memory_mb=195; best=8.08","next_action_hint":"Confirm the faster path against memory footprint and index correctness checks"}}
{"run":44,"metric":7.97,"metrics":{"memory_mb":195},"status":"keep","description":"Keep faster index path #44","timestamp":1776703200000,"segment":0,"confidence":3.71,"asi":{"hypothesis":"reuse parsed document manifests and stream index batches","evidence":"seconds=7.97; memory_mb=195; best=7.97","next_action_hint":"Confirm the faster path against memory footprint and index correctness checks"}}
{"run":45,"metric":7.9,"metrics":{"memory_mb":194},"status":"discard","description":"Reject slower index path #45","timestamp":1776703500000,"segment":0,"confidence":3.66,"asi":{"hypothesis":"try an alternate batching or cache strategy for the indexing pipeline","evidence":"seconds=7.9; memory_mb=194; best=7.97","next_action_hint":"Return to the best kept lane and try a smaller indexing change","rollback_reason":"slower than the best kept indexing path"}}
{"run":46,"metric":7.88,"metrics":{"memory_mb":193},"status":"keep","description":"Keep faster index path #46","timestamp":1776703800000,"segment":0,"confidence":3.76,"asi":{"hypothesis":"reuse parsed document manifests and stream index batches","evidence":"seconds=7.88; memory_mb=193; best=7.88","next_action_hint":"Confirm the faster path against memory footprint and index correctness checks"}}
{"run":47,"metric":7.91,"metrics":{"memory_mb":193},"status":"checks_failed","description":"Checks caught unsafe index path #47","timestamp":1776704100000,"segment":0,"confidence":3.71,"asi":{"hypothesis":"try an aggressive indexing cache or batch strategy","evidence":"seconds=7.91; memory_mb=193; best=7.88","next_action_hint":"Return to the best kept lane and try a smaller indexing change","rollback_reason":"correctness or memory checks failed despite a measurable speedup"}}
{"run":48,"metric":7.98,"metrics":{"memory_mb":192},"status":"discard","description":"Reject slower index path #48","timestamp":1776704400000,"segment":0,"confidence":3.66,"asi":{"hypothesis":"try an alternate batching or cache strategy for the indexing pipeline","evidence":"seconds=7.98; memory_mb=192; best=7.88","next_action_hint":"Return to the best kept lane and try a smaller indexing change","rollback_reason":"slower than the best kept indexing path"}}
{"run":49,"metric":8.07,"metrics":{"memory_mb":191},"status":"discard","description":"Reject slower index path #49","timestamp":1776704700000,"segment":0,"confidence":3.6,"asi":{"hypothesis":"try an alternate batching or cache strategy for the indexing pipeline","evidence":"seconds=8.07; memory_mb=191; best=7.88","next_action_hint":"Return to the best kept lane and try a smaller indexing change","rollback_reason":"slower than the best kept indexing path"}}
